"Peace notice manage change particular","This is a Peace notice manage change particular","0x02135ae4","Toys","2"
"Meet support range common start","This is a Meet support range common start","0x02135ae4","Games","3"
"Firm perform partner","This is a Firm perform partner","0x02135ae4","Books","4"
"Political institution individual deal","This is a Political institution individual deal","0x02135ae4","Clothing","5"
"One may visit rich","This is a One may visit rich","0x02135ae4","Sports","6"
"Act range","This is a Act range","0x02135ae4","Art","7"
"Money foot since training","This is a Money foot since training","0x02135ae4","Camera","8"
"Work plant off to","This is a Work plant off to","0x02135ae4","Grocery","9"
"Test morning article attack fast","This is a Test morning article attack fast","0x02135ae4","Health","10"
"Thousand season program","This is a Thousand season program","0x02135ae4","Electronics","1"
"Walk couple","This is a Walk couple","0x02135ae4","Toys","2"
"Join be part","This is a Join be part","0x02135ae4","Games","3"
"Affect can","This is a Affect can","0x02135ae4","Books","4"
"Base capital significant","This is a Base capital significant","0x02135ae4","Clothing","5"
"Traditional goal deal western list","This is a Traditional goal deal western list","0x02135ae4","Sports","6"
"View the mission teach meet","This is a View the mission teach meet","0x02135ae4","Art","7"
"Leader hear cause","This is a Leader hear cause","0x02135ae4","Camera","8"
"Magazine mean represent","This is a Magazine mean represent","0x02135ae4","Grocery","9"
"Design stay law call","This is a Design stay law call","0x02135ae4","Health","10"
"Although skill me movement","This is a Although skill me movement","0x02135ae4","Electronics","1"
"All capital modern determine","This is a All capital modern determine","0x02135ae4","Toys","2"
"Home deal important","This is a Home deal important","0x02135ae4","Games","3"
"Republican century discussion","This is a Republican century discussion","0x02135ae4","Books","4"
"Improve good save return father","This is a Improve good save return father","0x02135ae4","Clothing","5"
"Hear very during current","This is a Hear very during current","0x02135ae4","Sports","6"
"Trouble if example treatment together","This is a Trouble if example treatment together","0x02135ae4","Art","7"
"Style fish future","This is a Style fish future","0x02135ae4","Camera","8"
"Them radio face station career","This is a Them radio face station career","0x02135ae4","Grocery","9"
"Relationship no","This is a Relationship no","0x02135ae4","Health","10"
"Hard usually direction","This is a Hard usually direction","0x02135ae4","Electronics","1"
"She statement lot","This is a She statement lot","0x02135ae4","Toys","2"
"Young century again always car","This is a Young century again always car","0x02135ae4","Games","3"
"Put him local","This is a Put him local","0x02135ae4","Books","4"
"Money buy leg still","This is a Money buy leg still","0x02135ae4","Clothing","5"
"Low approach case reflect","This is a Low approach case reflect","0x02135ae4","Sports","6"
"Which lead probably base open","This is a Which lead probably base open","0x02135ae4","Art","7"
"Bar including","This is a Bar including","0x02135ae4","Camera","8"
"Debate front free","This is a Debate front free","0x02135ae4","Grocery","9"
"New natural discuss stay","This is a New natural discuss stay","0x02135ae4","Health","10"
"Machine admit culture culture","This is a Machine admit culture culture","0x02135ae4","Electronics","1"
"Participant cold machine","This is a Participant cold machine","0x02135ae4","Toys","2"
"Hotel community two back better","This is a Hotel community two back better","0x02135ae4","Games","3"
"Believe day fly area parent","This is a Believe day fly area parent","0x02135ae4","Books","4"
"One quickly mission score","This is a One quickly mission score","0x02135ae4","Clothing","5"
"Population process future else","This is a Population process future else","0x02135ae4","Sports","6"
"Art tell idea","This is a Art tell idea","0x02135ae4","Art","7"
"Line go","This is a Line go","0x02135ae4","Camera","8"
"Each scene control","This is a Each scene control","0x02135ae4","Grocery","9"
"Past stage reach story case","This is a Past stage reach story case","0x02135ae4","Health","10"
"Stand record produce","This is a Stand record produce","0x02135ae4","Electronics","1"
"Bar last generation","This is a Bar last generation","0x02135ae4","Toys","2"
"Century go","This is a Century go","0x02135ae4","Games","3"
"Analysis affect task","This is a Analysis affect task","0x02135ae4","Books","4"
"Already employee grow ok physical","This is a Already employee grow ok physical","0x02135ae4","Clothing","5"
"Establish husband heavy stuff","This is a Establish husband heavy stuff","0x02135ae4","Sports","6"
"Money fight region","This is a Money fight region","0x02135ae4","Art","7"
"Another everything those","This is a Another everything those","0x02135ae4","Camera","8"
"Perhaps old third","This is a Perhaps old third","0x02135ae4","Grocery","9"
"Treatment early wait","This is a Treatment early wait","0x02135ae4","Health","10"
"Size try","This is a Size try","0x02135ae4","Electronics","1"
"Event trouble image wind party","This is a Event trouble image wind party","0x02135ae4","Toys","2"
"Affect unit girl","This is a Affect unit girl","0x02135ae4","Games","3"
"Happen gas million such region","This is a Happen gas million such region","0x02135ae4","Books","4"
"Development section medical effect mention","This is a Development section medical effect mention","0x02135ae4","Clothing","5"
"Represent section performance gas","This is a Represent section performance gas","0x02135ae4","Sports","6"
"General must their form","This is a General must their form","0x02135ae4","Art","7"
"Identify stand positive record","This is a Identify stand positive record","0x02135ae4","Camera","8"
"Suddenly game least","This is a Suddenly game least","0x02135ae4","Grocery","9"
"Throughout much nation","This is a Throughout much nation","0x02135ae4","Health","10"
"Eight clear","This is a Eight clear","0x02135ae4","Electronics","1"
"Foot administration meet","This is a Foot administration meet","0x02135ae4","Toys","2"
"Child loss","This is a Child loss","0x02135ae4","Games","3"
"During professional enough accept stay","This is a During professional enough accept stay","0x02135ae4","Books","4"
"Note quite term try wait","This is a Note quite term try wait","0x02135ae4","Clothing","5"
"Ability officer drive rather understand","This is a Ability officer drive rather understand","0x02135ae4","Sports","6"
"Factor camera agree direction","This is a Factor camera agree direction","0x02135ae4","Art","7"
"Sort quality","This is a Sort quality","0x02135ae4","Camera","8"
"Front relate","This is a Front relate","0x02135ae4","Grocery","9"
"Boy defense company cover","This is a Boy defense company cover","0x02135ae4","Health","10"
"Way happy bad","This is a Way happy bad","0x02135ae4","Electronics","1"
"Price site wrong","This is a Price site wrong","0x02135ae4","Toys","2"
"Simply research matter","This is a Simply research matter","0x02135ae4","Games","3"
"Somebody bad top","This is a Somebody bad top","0x02135ae4","Books","4"
"Reduce recent look audience generation","This is a Reduce recent look audience generation","0x02135ae4","Clothing","5"
"Onto figure","This is a Onto figure","0x02135ae4","Sports","6"
"Tough adult possible","This is a Tough adult possible","0x02135ae4","Art","7"
"Sister relationship plan your","This is a Sister relationship plan your","0x02135ae4","Camera","8"
"Star difficult sea other set","This is a Star difficult sea other set","0x02135ae4","Grocery","9"
"Meet many decade gun see","This is a Meet many decade gun see","0x02135ae4","Health","10"
"Effort school about television","This is a Effort school about television","0x02135ae4","Electronics","1"
"Enough American over road","This is a Enough American over road","0x02135ae4","Toys","2"
"Stay TV sure statement","This is a Stay TV sure statement","0x02135ae4","Games","3"
"Third three sister cut product","This is a Third three sister cut product","0x02135ae4","Books","4"
"Home employee month fund","This is a Home employee month fund","0x02135ae4","Clothing","5"
"Forget building ground","This is a Forget building ground","0x02135ae4","Sports","6"
"Training human bit","This is a Training human bit","0x02135ae4","Art","7"
"Once style measure use","This is a Once style measure use","0x02135ae4","Camera","8"
"Group class argue","This is a Group class argue","0x02135ae4","Grocery","9"
"List fire develop","This is a List fire develop","0x02135ae4","Health","10"
"Collection personal network nature","This is a Collection personal network nature","0x02135ae4","Electronics","1"
"Machine candidate loss","This is a Machine candidate loss","0x02135ae4","Toys","2"
"Year particular maybe within","This is a Year particular maybe within","0x02135ae4","Games","3"
"Decision assume","This is a Decision assume","0x02135ae4","Books","4"
"Her however modern along","This is a Her however modern along","0x02135ae4","Clothing","5"
"Century energy reduce old","This is a Century energy reduce old","0x02135ae4","Sports","6"
"Simple between say statement","This is a Simple between say statement","0x02135ae4","Art","7"
"Difference police identify carry minute","This is a Difference police identify carry minute","0x02135ae4","Camera","8"
"Know board stuff factor kind","This is a Know board stuff factor kind","0x02135ae4","Grocery","9"
"History blood whose marriage","This is a History blood whose marriage","0x02135ae4","Health","10"
"Computer Democrat common both","This is a Computer Democrat common both","0x02135ae4","Electronics","1"
"Strategy physical campaign store middle","This is a Strategy physical campaign store middle","0x02135ae4","Toys","2"
"Positive kind development impact plant","This is a Positive kind development impact plant","0x02135ae4","Games","3"
"Wait work more","This is a Wait work more","0x02135ae4","Books","4"
"Matter some man","This is a Matter some man","0x02135ae4","Clothing","5"
"Always response long star","This is a Always response long star","0x02135ae4","Sports","6"
"Sense often from reach","This is a Sense often from reach","0x02135ae4","Art","7"
"Whether every also will","This is a Whether every also will","0x02135ae4","Camera","8"
"Direction democratic","This is a Direction democratic","0x02135ae4","Grocery","9"
"Wrong Mr company if","This is a Wrong Mr company if","0x02135ae4","Health","10"
"Message age hand","This is a Message age hand","0x02135ae4","Electronics","1"
"Final listen certain","This is a Final listen certain","0x02135ae4","Toys","2"
"Southern other but certainly","This is a Southern other but certainly","0x02135ae4","Games","3"
"Production maintain food sure","This is a Production maintain food sure","0x02135ae4","Books","4"
"Economic gas five","This is a Economic gas five","0x02135ae4","Clothing","5"
"Office score four","This is a Office score four","0x02135ae4","Sports","6"
"Suddenly myself imagine kitchen","This is a Suddenly myself imagine kitchen","0x02135ae4","Art","7"
"Prepare fight","This is a Prepare fight","0x02135ae4","Camera","8"
"Agent reason she","This is a Agent reason she","0x02135ae4","Grocery","9"
"Figure produce across","This is a Figure produce across","0x02135ae4","Health","10"
"Pattern a article","This is a Pattern a article","0x02135ae4","Electronics","1"
"Wind method gun go base","This is a Wind method gun go base","0x02135ae4","Toys","2"
"Strong against carry someone west","This is a Strong against carry someone west","0x02135ae4","Games","3"
"Free baby opportunity environmental certain","This is a Free baby opportunity environmental certain","0x02135ae4","Books","4"
"Oil popular order join future","This is a Oil popular order join future","0x02135ae4","Clothing","5"
"Reach leg bring accept","This is a Reach leg bring accept","0x02135ae4","Sports","6"
"Quickly grow make","This is a Quickly grow make","0x02135ae4","Art","7"
"Threat house her move","This is a Threat house her move","0x02135ae4","Camera","8"
"Conference type","This is a Conference type","0x02135ae4","Grocery","9"
"Generation almost score city","This is a Generation almost score city","0x02135ae4","Health","10"
"So yet fact","This is a So yet fact","0x02135ae4","Electronics","1"
"Low Republican since present guy","This is a Low Republican since present guy","0x02135ae4","Toys","2"
"Management reduce skill","This is a Management reduce skill","0x02135ae4","Games","3"
"Hard according east","This is a Hard according east","0x02135ae4","Books","4"
"Year day society him film","This is a Year day society him film","0x02135ae4","Clothing","5"
"Information south","This is a Information south","0x02135ae4","Sports","6"
"Pattern concern toward fast","This is a Pattern concern toward fast","0x02135ae4","Art","7"
"Produce general parent heart over","This is a Produce general parent heart over","0x02135ae4","Camera","8"
"Information since both very along","This is a Information since both very along","0x02135ae4","Grocery","9"
"Make time since","This is a Make time since","0x02135ae4","Health","10"
"Direction security window send","This is a Direction security window send","0x02135ae4","Electronics","1"
"When seven card safe","This is a When seven card safe","0x02135ae4","Toys","2"
"Campaign your among now","This is a Campaign your among now","0x02135ae4","Games","3"
"Report heart heart that American","This is a Report heart heart that American","0x02135ae4","Books","4"
"Hard figure hope partner","This is a Hard figure hope partner","0x02135ae4","Clothing","5"
"Ask information season eat indicate","This is a Ask information season eat indicate","0x02135ae4","Sports","6"
"Story yet occur lot hit","This is a Story yet occur lot hit","0x02135ae4","Art","7"
"Risk painting camera film","This is a Risk painting camera film","0x02135ae4","Camera","8"
"Central they film leader","This is a Central they film leader","0x02135ae4","Grocery","9"
"Bring growth mention","This is a Bring growth mention","0x02135ae4","Health","10"
"Until American need outside","This is a Until American need outside","0x02135ae4","Electronics","1"
"Plant environmental time option","This is a Plant environmental time option","0x02135ae4","Toys","2"
"Produce five","This is a Produce five","0x02135ae4","Games","3"
"Better court name among","This is a Better court name among","0x02135ae4","Books","4"
"Require explain call newspaper","This is a Require explain call newspaper","0x02135ae4","Clothing","5"
"Soon decide street pretty","This is a Soon decide street pretty","0x02135ae4","Sports","6"
"Include positive join plant ever","This is a Include positive join plant ever","0x02135ae4","Art","7"
"Able far","This is a Able far","0x02135ae4","Camera","8"
"American several theory people","This is a American several theory people","0x02135ae4","Grocery","9"
"Parent certain cut","This is a Parent certain cut","0x02135ae4","Health","10"
"Politics town recent blue politics","This is a Politics town recent blue politics","0x02135ae4","Electronics","1"
"Base conference mouth dog","This is a Base conference mouth dog","0x02135ae4","Toys","2"
"Modern owner it message","This is a Modern owner it message","0x02135ae4","Games","3"
"Respond today method know not","This is a Respond today method know not","0x02135ae4","Books","4"
"Them general family science","This is a Them general family science","0x02135ae4","Clothing","5"
"He wish","This is a He wish","0x02135ae4","Sports","6"
"Grow story alone","This is a Grow story alone","0x02135ae4","Art","7"
"Nature door difference become","This is a Nature door difference become","0x02135ae4","Camera","8"
"Area third","This is a Area third","0x02135ae4","Grocery","9"
"Matter physical identify garden","This is a Matter physical identify garden","0x02135ae4","Health","10"
"Another car behavior game including","This is a Another car behavior game including","0x02135ae4","Electronics","1"
"Know throughout","This is a Know throughout","0x02135ae4","Toys","2"
"Common level let great performance","This is a Common level let great performance","0x02135ae4","Games","3"
"Put detail","This is a Put detail","0x02135ae4","Books","4"
"Away thing bed concern worker","This is a Away thing bed concern worker","0x02135ae4","Clothing","5"
"This purpose wrong","This is a This purpose wrong","0x02135ae4","Sports","6"
"Blue manage player administration choose","This is a Blue manage player administration choose","0x02135ae4","Art","7"
"Small long","This is a Small long","0x02135ae4","Camera","8"
"Its someone point","This is a Its someone point","0x02135ae4","Grocery","9"
"Clearly young against","This is a Clearly young against","0x02135ae4","Health","10"
"Where Mrs","This is a Where Mrs","0x02135ae4","Electronics","1"
"Current sister","This is a Current sister","0x02135ae4","Toys","2"
"Southern size run reason act","This is a Southern size run reason act","0x02135ae4","Games","3"
"Mission even against talk","This is a Mission even against talk","0x02135ae4","Books","4"
"Magazine cup create","This is a Magazine cup create","0x02135ae4","Clothing","5"
"Food study","This is a Food study","0x02135ae4","Sports","6"
"Suggest state huge his","This is a Suggest state huge his","0x02135ae4","Art","7"
"Road science find west include","This is a Road science find west include","0x02135ae4","Camera","8"
"Treat model build","This is a Treat model build","0x02135ae4","Grocery","9"
"Stuff safe glass PM","This is a Stuff safe glass PM","0x02135ae4","Health","10"
"Loss rock notice play green","This is a Loss rock notice play green","0x02135ae4","Electronics","1"
"Media each toward discover","This is a Media each toward discover","0x02135ae4","Toys","2"
"Film these issue","This is a Film these issue","0x02135ae4","Games","3"
"Example agency career","This is a Example agency career","0x02135ae4","Books","4"
"Daughter wind term manager","This is a Daughter wind term manager","0x02135ae4","Clothing","5"
"Area probably line and","This is a Area probably line and","0x02135ae4","Sports","6"
"Beyond such offer much charge","This is a Beyond such offer much charge","0x02135ae4","Art","7"
"Process right fight stay player","This is a Process right fight stay player","0x02135ae4","Camera","8"
"Else pass tonight","This is a Else pass tonight","0x02135ae4","Grocery","9"
"Learn exactly reach difficult represent","This is a Learn exactly reach difficult represent","0x02135ae4","Health","10"
"Early quality meet","This is a Early quality meet","0x02135ae4","Electronics","1"
"Test operation development","This is a Test operation development","0x02135ae4","Toys","2"
"Sure seat model","This is a Sure seat model","0x02135ae4","Games","3"
"Manage much","This is a Manage much","0x02135ae4","Books","4"
"Air her key","This is a Air her key","0x02135ae4","Clothing","5"
"Into toward six sing","This is a Into toward six sing","0x02135ae4","Sports","6"
"Music suggest fund","This is a Music suggest fund","0x02135ae4","Art","7"
"About student half","This is a About student half","0x02135ae4","Camera","8"
"Heart spring those","This is a Heart spring those","0x02135ae4","Grocery","9"
"Situation reflect new choose","This is a Situation reflect new choose","0x02135ae4","Health","10"
"House each","This is a House each","0x02135ae4","Electronics","1"
"Yes cause","This is a Yes cause","0x02135ae4","Toys","2"
"Few let reveal","This is a Few let reveal","0x02135ae4","Games","3"
"Few mind soon","This is a Few mind soon","0x02135ae4","Books","4"
"Good toward street process work","This is a Good toward street process work","0x02135ae4","Clothing","5"
"Bring marriage dark hour","This is a Bring marriage dark hour","0x02135ae4","Sports","6"
"Visit article","This is a Visit article","0x02135ae4","Art","7"
"Less specific","This is a Less specific","0x02135ae4","Camera","8"
"With style kind win","This is a With style kind win","0x02135ae4","Grocery","9"
"Question week along change","This is a Question week along change","0x02135ae4","Health","10"
"Make available tree","This is a Make available tree","0x02135ae4","Electronics","1"
"Mrs usually","This is a Mrs usually","0x02135ae4","Toys","2"
"Would professional gun describe nature","This is a Would professional gun describe nature","0x02135ae4","Games","3"
"Customer score finally ahead when","This is a Customer score finally ahead when","0x02135ae4","Books","4"
"Point set unit gas","This is a Point set unit gas","0x02135ae4","Clothing","5"
"Your approach subject possible first","This is a Your approach subject possible first","0x02135ae4","Sports","6"
"Heavy amount middle us nearly","This is a Heavy amount middle us nearly","0x02135ae4","Art","7"
"Major six your","This is a Major six your","0x02135ae4","Camera","8"
"Dream determine action why","This is a Dream determine action why","0x02135ae4","Grocery","9"
"Too laugh","This is a Too laugh","0x02135ae4","Health","10"
"Throughout believe project","This is a Throughout believe project","0x02135ae4","Electronics","1"
"Quickly involve of service","This is a Quickly involve of service","0x02135ae4","Toys","2"
"Easy environment heart","This is a Easy environment heart","0x02135ae4","Games","3"
"Product eye remain ten","This is a Product eye remain ten","0x02135ae4","Books","4"
"Energy defense tax discuss according","This is a Energy defense tax discuss according","0x02135ae4","Clothing","5"
"Follow attention act hand","This is a Follow attention act hand","0x02135ae4","Sports","6"
"Anyone nor even common","This is a Anyone nor even common","0x02135ae4","Art","7"
"Subject effect message west take","This is a Subject effect message west take","0x02135ae4","Camera","8"
"Yeah whole","This is a Yeah whole","0x02135ae4","Grocery","9"
"These which sign politics enter","This is a These which sign politics enter","0x02135ae4","Health","10"
"Involve large important","This is a Involve large important","0x02135ae4","Electronics","1"
"Effect six too trip","This is a Effect six too trip","0x02135ae4","Toys","2"
"Most new oil special success","This is a Most new oil special success","0x02135ae4","Games","3"
"Contain tell tough word","This is a Contain tell tough word","0x02135ae4","Books","4"
"Along speech food","This is a Along speech food","0x02135ae4","Clothing","5"
"Air easy","This is a Air easy","0x02135ae4","Sports","6"
"Avoid suffer democratic","This is a Avoid suffer democratic","0x02135ae4","Art","7"
"Onto control nearly evidence something","This is a Onto control nearly evidence something","0x02135ae4","Camera","8"
"Themselves character international account","This is a Themselves character international account","0x02135ae4","Grocery","9"
"Only four a","This is a Only four a","0x02135ae4","Health","10"
"Moment natural computer","This is a Moment natural computer","0x02135ae4","Electronics","1"
"Parent nor make development","This is a Parent nor make development","0x02135ae4","Toys","2"
"Try gun national minute","This is a Try gun national minute","0x02135ae4","Games","3"
"Water exist page school","This is a Water exist page school","0x02135ae4","Books","4"
"Above environmental","This is a Above environmental","0x02135ae4","Clothing","5"
"Power hour court pretty arm","This is a Power hour court pretty arm","0x02135ae4","Sports","6"
"The prevent quickly foot star","This is a The prevent quickly foot star","0x02135ae4","Art","7"
"Movie present people remember","This is a Movie present people remember","0x02135ae4","Camera","8"
"Kid important risk","This is a Kid important risk","0x02135ae4","Grocery","9"
"Others beautiful adult","This is a Others beautiful adult","0x02135ae4","Health","10"
"Bed street down","This is a Bed street down","0x02135ae4","Electronics","1"
"Food clearly society should think","This is a Food clearly society should think","0x02135ae4","Toys","2"
"Behavior the","This is a Behavior the","0x02135ae4","Games","3"
"Take body suggest","This is a Take body suggest","0x02135ae4","Books","4"
"Machine company many agency","This is a Machine company many agency","0x02135ae4","Clothing","5"
"Finally raise staff","This is a Finally raise staff","0x02135ae4","Sports","6"
"College me fast","This is a College me fast","0x02135ae4","Art","7"
"Teacher mission","This is a Teacher mission","0x02135ae4","Camera","8"
"Ball stop enough decade","This is a Ball stop enough decade","0x02135ae4","Grocery","9"
"Quality get able where","This is a Quality get able where","0x02135ae4","Health","10"
"During subject","This is a During subject","0x02135ae4","Electronics","1"
"Yes both edge","This is a Yes both edge","0x02135ae4","Toys","2"
"Education shake","This is a Education shake","0x02135ae4","Games","3"
"Heavy movement hear decide support","This is a Heavy movement hear decide support","0x02135ae4","Books","4"
"Music see","This is a Music see","0x02135ae4","Clothing","5"
"Mean million both","This is a Mean million both","0x02135ae4","Sports","6"
"Company sea television","This is a Company sea television","0x02135ae4","Art","7"
"Out recent federal","This is a Out recent federal","0x02135ae4","Camera","8"
"Successful animal no take","This is a Successful animal no take","0x02135ae4","Grocery","9"
"Television conference staff discover","This is a Television conference staff discover","0x02135ae4","Health","10"
"Actually born energy think","This is a Actually born energy think","0x02135ae4","Electronics","1"
"Could usually beyond view","This is a Could usually beyond view","0x02135ae4","Toys","2"
"War address guy","This is a War address guy","0x02135ae4","Games","3"
"Detail tell hospital also billion","This is a Detail tell hospital also billion","0x02135ae4","Books","4"
"Land happen","This is a Land happen","0x02135ae4","Clothing","5"
"Worry close religious environment task","This is a Worry close religious environment task","0x02135ae4","Sports","6"
"Fly fact world water","This is a Fly fact world water","0x02135ae4","Art","7"
