"Middle name debate same special","This is a Middle name debate same special","0x02135ae4","Electronics","1"
"Town town present","This is a Town town present","0x02135ae4","Toys","2"
"Turn it draw","This is a Turn it draw","0x02135ae4","Games","3"
"Not better speech","This is a Not better speech","0x02135ae4","Books","4"
"Question manager pass arm","This is a Question manager pass arm","0x02135ae4","Clothing","5"
"Medical mouth station","This is a Medical mouth station","0x02135ae4","Sports","6"
"Fund agreement relate decision","This is a Fund agreement relate decision","0x02135ae4","Art","7"
"Where change brother","This is a Where change brother","0x02135ae4","Camera","8"
"Tend poor","This is a Tend poor","0x02135ae4","Grocery","9"
"Bad say event number local","This is a Bad say event number local","0x02135ae4","Health","10"
"Health whether middle","This is a Health whether middle","0x02135ae4","Electronics","1"
"Network control sound","This is a Network control sound","0x02135ae4","Toys","2"
"Quality study central explain say","This is a Quality study central explain say","0x02135ae4","Games","3"
"Couple degree","This is a Couple degree","0x02135ae4","Books","4"
"High poor energy","This is a High poor energy","0x02135ae4","Clothing","5"
"Despite child thing radio ago","This is a Despite child thing radio ago","0x02135ae4","Sports","6"
"Begin body relationship next","This is a Begin body relationship next","0x02135ae4","Art","7"
"Have whole","This is a Have whole","0x02135ae4","Camera","8"
"Believe let change","This is a Believe let change","0x02135ae4","Grocery","9"
"Lead even relationship article","This is a Lead even relationship article","0x02135ae4","Health","10"
"Former organization could girl improve","This is a Former organization could girl improve","0x02135ae4","Electronics","1"
"Lay upon hard","This is a Lay upon hard","0x02135ae4","Toys","2"
"However certainly detail cultural","This is a However certainly detail cultural","0x02135ae4","Games","3"
"Art so","This is a Art so","0x02135ae4","Books","4"
"Billion garden animal eye","This is a Billion garden animal eye","0x02135ae4","Clothing","5"
"Country different prepare","This is a Country different prepare","0x02135ae4","Sports","6"
"Total sign back arrive financial","This is a Total sign back arrive financial","0x02135ae4","Art","7"
"Item life","This is a Item life","0x02135ae4","Camera","8"
"Somebody minute","This is a Somebody minute","0x02135ae4","Grocery","9"
"Peace should cost","This is a Peace should cost","0x02135ae4","Health","10"
"Ahead stock hear","This is a Ahead stock hear","0x02135ae4","Electronics","1"
"Box onto","This is a Box onto","0x02135ae4","Toys","2"
"Behind may matter hope","This is a Behind may matter hope","0x02135ae4","Games","3"
"Store current nor","This is a Store current nor","0x02135ae4","Books","4"
"Career hotel environment prepare","This is a Career hotel environment prepare","0x02135ae4","Clothing","5"
"Money everything represent","This is a Money everything represent","0x02135ae4","Sports","6"
"History walk up","This is a History walk up","0x02135ae4","Art","7"
"Upon wonder","This is a Upon wonder","0x02135ae4","Camera","8"
"Public hear","This is a Public hear","0x02135ae4","Grocery","9"
"Despite late collection","This is a Despite late collection","0x02135ae4","Health","10"
"Write certain wide give front","This is a Write certain wide give front","0x02135ae4","Electronics","1"
"Lose sing player old","This is a Lose sing player old","0x02135ae4","Toys","2"
"Possible chance manage position","This is a Possible chance manage position","0x02135ae4","Games","3"
"Democrat owner authority","This is a Democrat owner authority","0x02135ae4","Books","4"
"Around oil college low","This is a Around oil college low","0x02135ae4","Clothing","5"
"Nearly lose physical","This is a Nearly lose physical","0x02135ae4","Sports","6"
"Agency part","This is a Agency part","0x02135ae4","Art","7"
"Conference service","This is a Conference service","0x02135ae4","Camera","8"
"Protect style others response fly","This is a Protect style others response fly","0x02135ae4","Grocery","9"
"Republican price game quite","This is a Republican price game quite","0x02135ae4","Health","10"
"Happy whose daughter purpose allow","This is a Happy whose daughter purpose allow","0x02135ae4","Electronics","1"
"Product behind suffer to","This is a Product behind suffer to","0x02135ae4","Toys","2"
"Candidate loss there","This is a Candidate loss there","0x02135ae4","Games","3"
"Feeling none name situation","This is a Feeling none name situation","0x02135ae4","Books","4"
"Remain so expert","This is a Remain so expert","0x02135ae4","Clothing","5"
"Ball young carry investment","This is a Ball young carry investment","0x02135ae4","Sports","6"
"Bed cover white common","This is a Bed cover white common","0x02135ae4","Art","7"
"Environmental shoulder","This is a Environmental shoulder","0x02135ae4","Camera","8"
"Me bar so","This is a Me bar so","0x02135ae4","Grocery","9"
"Old clearly","This is a Old clearly","0x02135ae4","Health","10"
"Campaign check","This is a Campaign check","0x02135ae4","Electronics","1"
"Cost of part","This is a Cost of part","0x02135ae4","Toys","2"
"Our for","This is a Our for","0x02135ae4","Games","3"
"Include that real share","This is a Include that real share","0x02135ae4","Books","4"
"Senior require first","This is a Senior require first","0x02135ae4","Clothing","5"
"Today hospital lead","This is a Today hospital lead","0x02135ae4","Sports","6"
"With election serve","This is a With election serve","0x02135ae4","Art","7"
"Us fill analysis hope","This is a Us fill analysis hope","0x02135ae4","Camera","8"
"Across could positive organization each","This is a Across could positive organization each","0x02135ae4","Grocery","9"
"Thousand enjoy from","This is a Thousand enjoy from","0x02135ae4","Health","10"
"Popular or benefit represent who","This is a Popular or benefit represent who","0x02135ae4","Electronics","1"
"Attorney off human eat guess","This is a Attorney off human eat guess","0x02135ae4","Toys","2"
"Bank soon","This is a Bank soon","0x02135ae4","Games","3"
"My others order director","This is a My others order director","0x02135ae4","Books","4"
"Audience school","This is a Audience school","0x02135ae4","Clothing","5"
"Ahead suffer","This is a Ahead suffer","0x02135ae4","Sports","6"
"Radio something project boy","This is a Radio something project boy","0x02135ae4","Art","7"
"Certain country","This is a Certain country","0x02135ae4","Camera","8"
"Always simply shake special current","This is a Always simply shake special current","0x02135ae4","Grocery","9"
"Office the design","This is a Office the design","0x02135ae4","Health","10"
"Crime son yes","This is a Crime son yes","0x02135ae4","Electronics","1"
"Doctor life","This is a Doctor life","0x02135ae4","Toys","2"
"Society least tend society cold","This is a Society least tend society cold","0x02135ae4","Games","3"
"Employee per name","This is a Employee per name","0x02135ae4","Books","4"
"War conference around","This is a War conference around","0x02135ae4","Clothing","5"
"Manage president call","This is a Manage president call","0x02135ae4","Sports","6"
"Have couple environment citizen","This is a Have couple environment citizen","0x02135ae4","Art","7"
"Author year letter fast","This is a Author year letter fast","0x02135ae4","Camera","8"
"Ground everything develop role","This is a Ground everything develop role","0x02135ae4","Grocery","9"
"Tree choice","This is a Tree choice","0x02135ae4","Health","10"
"Business our view herself","This is a Business our view herself","0x02135ae4","Electronics","1"
"Nearly play success role partner","This is a Nearly play success role partner","0x02135ae4","Toys","2"
"Itself man off series","This is a Itself man off series","0x02135ae4","Games","3"
"Remember little argue","This is a Remember little argue","0x02135ae4","Books","4"
"First collection whether issue story","This is a First collection whether issue story","0x02135ae4","Clothing","5"
"Structure computer police","This is a Structure computer police","0x02135ae4","Sports","6"
"Do may bad important second","This is a Do may bad important second","0x02135ae4","Art","7"
"Win form great","This is a Win form great","0x02135ae4","Camera","8"
"Explain should morning","This is a Explain should morning","0x02135ae4","Grocery","9"
"Parent behavior each data money","This is a Parent behavior each data money","0x02135ae4","Health","10"
"After participant soon","This is a After participant soon","0x02135ae4","Electronics","1"
"For others wear","This is a For others wear","0x02135ae4","Toys","2"
"Eat after piece news Mrs","This is a Eat after piece news Mrs","0x02135ae4","Games","3"
"Arm ready foreign whose","This is a Arm ready foreign whose","0x02135ae4","Books","4"
"Recent hotel population husband","This is a Recent hotel population husband","0x02135ae4","Clothing","5"
"Republican he indeed few","This is a Republican he indeed few","0x02135ae4","Sports","6"
"Author civil stage possible","This is a Author civil stage possible","0x02135ae4","Art","7"
"Page discover raise and","This is a Page discover raise and","0x02135ae4","Camera","8"
"Toward design","This is a Toward design","0x02135ae4","Grocery","9"
"Heavy degree wonder","This is a Heavy degree wonder","0x02135ae4","Health","10"
"Reduce draw hospital account","This is a Reduce draw hospital account","0x02135ae4","Electronics","1"
"Area piece stop benefit","This is a Area piece stop benefit","0x02135ae4","Toys","2"
"North speech reason","This is a North speech reason","0x02135ae4","Games","3"
"After control these short","This is a After control these short","0x02135ae4","Books","4"
"Modern deep particularly","This is a Modern deep particularly","0x02135ae4","Clothing","5"
"Mention author risk million","This is a Mention author risk million","0x02135ae4","Sports","6"
"Policy minute dinner at","This is a Policy minute dinner at","0x02135ae4","Art","7"
"Serve like mention fight","This is a Serve like mention fight","0x02135ae4","Camera","8"
"Fear computer camera rise seat","This is a Fear computer camera rise seat","0x02135ae4","Grocery","9"
"Fast force hour","This is a Fast force hour","0x02135ae4","Health","10"
"Class class at former","This is a Class class at former","0x02135ae4","Electronics","1"
"Wrong nor political whose future","This is a Wrong nor political whose future","0x02135ae4","Toys","2"
"Central stage Congress","This is a Central stage Congress","0x02135ae4","Games","3"
"Reason first","This is a Reason first","0x02135ae4","Books","4"
"Something type off exist","This is a Something type off exist","0x02135ae4","Clothing","5"
"Cover debate decade table visit","This is a Cover debate decade table visit","0x02135ae4","Sports","6"
"Employee lose","This is a Employee lose","0x02135ae4","Art","7"
"Only method rate wife again","This is a Only method rate wife again","0x02135ae4","Camera","8"
"Every feel huge","This is a Every feel huge","0x02135ae4","Grocery","9"
"Several thank college discover first","This is a Several thank college discover first","0x02135ae4","Health","10"
"Discussion I investment goal","This is a Discussion I investment goal","0x02135ae4","Electronics","1"
"Fall clear ten","This is a Fall clear ten","0x02135ae4","Toys","2"
"Hotel develop","This is a Hotel develop","0x02135ae4","Games","3"
"Nothing chance community special","This is a Nothing chance community special","0x02135ae4","Books","4"
"Do professor drive team into","This is a Do professor drive team into","0x02135ae4","Clothing","5"
"Game thing","This is a Game thing","0x02135ae4","Sports","6"
"Seem put","This is a Seem put","0x02135ae4","Art","7"
"Reveal successful seem","This is a Reveal successful seem","0x02135ae4","Camera","8"
"Fact sense","This is a Fact sense","0x02135ae4","Grocery","9"
"Area hot stand","This is a Area hot stand","0x02135ae4","Health","10"
"South between interest program state","This is a South between interest program state","0x02135ae4","Electronics","1"
"No him thought","This is a No him thought","0x02135ae4","Toys","2"
"Affect significant entire","This is a Affect significant entire","0x02135ae4","Games","3"
"Not executive","This is a Not executive","0x02135ae4","Books","4"
"Us back each","This is a Us back each","0x02135ae4","Clothing","5"
"Himself sign again","This is a Himself sign again","0x02135ae4","Sports","6"
"Enjoy than occur occur","This is a Enjoy than occur occur","0x02135ae4","Art","7"
"Beyond item debate","This is a Beyond item debate","0x02135ae4","Camera","8"
"Forget involve well interest","This is a Forget involve well interest","0x02135ae4","Grocery","9"
"Mean performance act across expert","This is a Mean performance act across expert","0x02135ae4","Health","10"
"Vote final walk","This is a Vote final walk","0x02135ae4","Electronics","1"
"International shoulder field","This is a International shoulder field","0x02135ae4","Toys","2"
"Many house often police","This is a Many house often police","0x02135ae4","Games","3"
"Season audience","This is a Season audience","0x02135ae4","Books","4"
"Oil its mission","This is a Oil its mission","0x02135ae4","Clothing","5"
"Knowledge human feel","This is a Knowledge human feel","0x02135ae4","Sports","6"
"Against song happen","This is a Against song happen","0x02135ae4","Art","7"
"Form left land","This is a Form left land","0x02135ae4","Camera","8"
"Consider research majority type","This is a Consider research majority type","0x02135ae4","Grocery","9"
"Far couple none community","This is a Far couple none community","0x02135ae4","Health","10"
"That set accept city","This is a That set accept city","0x02135ae4","Electronics","1"
"Draw line page car image","This is a Draw line page car image","0x02135ae4","Toys","2"
"Miss Mr","This is a Miss Mr","0x02135ae4","Games","3"
"Million form interesting","This is a Million form interesting","0x02135ae4","Books","4"
"Risk key positive","This is a Risk key positive","0x02135ae4","Clothing","5"
"Yard hard","This is a Yard hard","0x02135ae4","Sports","6"
"Fish road","This is a Fish road","0x02135ae4","Art","7"
"Collection reduce industry interview international","This is a Collection reduce industry interview international","0x02135ae4","Camera","8"
"How interest oil","This is a How interest oil","0x02135ae4","Grocery","9"
"First himself idea","This is a First himself idea","0x02135ae4","Health","10"
"Thought could","This is a Thought could","0x02135ae4","Electronics","1"
"Majority help","This is a Majority help","0x02135ae4","Toys","2"
"Think maintain camera two","This is a Think maintain camera two","0x02135ae4","Games","3"
"Today clearly occur","This is a Today clearly occur","0x02135ae4","Books","4"
"Stand shoulder avoid","This is a Stand shoulder avoid","0x02135ae4","Clothing","5"
"Window very daughter","This is a Window very daughter","0x02135ae4","Sports","6"
"Save home sure","This is a Save home sure","0x02135ae4","Art","7"
"Clearly so clear","This is a Clearly so clear","0x02135ae4","Camera","8"
"Audience far","This is a Audience far","0x02135ae4","Grocery","9"
"Community ball of instead","This is a Community ball of instead","0x02135ae4","Health","10"
"Yet order party bit","This is a Yet order party bit","0x02135ae4","Electronics","1"
"Major hope economy","This is a Major hope economy","0x02135ae4","Toys","2"
"Responsibility these star boy","This is a Responsibility these star boy","0x02135ae4","Games","3"
"Medical pull join interest few","This is a Medical pull join interest few","0x02135ae4","Books","4"
"Family I history","This is a Family I history","0x02135ae4","Clothing","5"
"Seven might opportunity","This is a Seven might opportunity","0x02135ae4","Sports","6"
"Edge arrive table similar bed","This is a Edge arrive table similar bed","0x02135ae4","Art","7"
"Nothing analysis since response citizen","This is a Nothing analysis since response citizen","0x02135ae4","Camera","8"
"Door will floor","This is a Door will floor","0x02135ae4","Grocery","9"
"Already partner smile","This is a Already partner smile","0x02135ae4","Health","10"
"Assume shake organization","This is a Assume shake organization","0x02135ae4","Electronics","1"
"Idea authority position","This is a Idea authority position","0x02135ae4","Toys","2"
"Site bed foot opportunity","This is a Site bed foot opportunity","0x02135ae4","Games","3"
"Factor level best yes late","This is a Factor level best yes late","0x02135ae4","Books","4"
"Any cause computer throughout","This is a Any cause computer throughout","0x02135ae4","Clothing","5"
"Dream sell","This is a Dream sell","0x02135ae4","Sports","6"
"Visit stand mother get","This is a Visit stand mother get","0x02135ae4","Art","7"
"Morning movement stay skill cell","This is a Morning movement stay skill cell","0x02135ae4","Camera","8"
"Art people physical once","This is a Art people physical once","0x02135ae4","Grocery","9"
"Would reveal all","This is a Would reveal all","0x02135ae4","Health","10"
"Management before agent ok","This is a Management before agent ok","0x02135ae4","Electronics","1"
"Some forward suggest","This is a Some forward suggest","0x02135ae4","Toys","2"
"Campaign sit increase challenge","This is a Campaign sit increase challenge","0x02135ae4","Games","3"
"Five safe produce may","This is a Five safe produce may","0x02135ae4","Books","4"
"Play later stop bill","This is a Play later stop bill","0x02135ae4","Clothing","5"
"Will speak or activity","This is a Will speak or activity","0x02135ae4","Sports","6"
"Billion region","This is a Billion region","0x02135ae4","Art","7"
"Seem medical goal tonight","This is a Seem medical goal tonight","0x02135ae4","Camera","8"
"Traditional suggest event organization top","This is a Traditional suggest event organization top","0x02135ae4","Grocery","9"
"Thing risk value two","This is a Thing risk value two","0x02135ae4","Health","10"
"Get boy break present authority","This is a Get boy break present authority","0x02135ae4","Electronics","1"
"Will rate travel","This is a Will rate travel","0x02135ae4","Toys","2"
"Strong charge director compare might","This is a Strong charge director compare might","0x02135ae4","Games","3"
"Painting range sit","This is a Painting range sit","0x02135ae4","Books","4"
"Book support size city","This is a Book support size city","0x02135ae4","Clothing","5"
"Two dog","This is a Two dog","0x02135ae4","Sports","6"
"Total sign know laugh","This is a Total sign know laugh","0x02135ae4","Art","7"
"After beat entire think","This is a After beat entire think","0x02135ae4","Camera","8"
"Its begin hair","This is a Its begin hair","0x02135ae4","Grocery","9"
"Place I item","This is a Place I item","0x02135ae4","Health","10"
"From land population fly season","This is a From land population fly season","0x02135ae4","Electronics","1"
"Quickly piece value education","This is a Quickly piece value education","0x02135ae4","Toys","2"
"Line what professional","This is a Line what professional","0x02135ae4","Games","3"
"Ready TV information black rule","This is a Ready TV information black rule","0x02135ae4","Books","4"
"Yes find","This is a Yes find","0x02135ae4","Clothing","5"
"Design no such","This is a Design no such","0x02135ae4","Sports","6"
"Main garden","This is a Main garden","0x02135ae4","Art","7"
"Happen health learn west happy","This is a Happen health learn west happy","0x02135ae4","Camera","8"
"Agent matter design prevent","This is a Agent matter design prevent","0x02135ae4","Grocery","9"
"Provide vote hotel check push","This is a Provide vote hotel check push","0x02135ae4","Health","10"
"Check country outside","This is a Check country outside","0x02135ae4","Electronics","1"
"Human western role","This is a Human western role","0x02135ae4","Toys","2"
"Address service ever impact explain","This is a Address service ever impact explain","0x02135ae4","Games","3"
"Century process spring","This is a Century process spring","0x02135ae4","Books","4"
"Hear scene study window","This is a Hear scene study window","0x02135ae4","Clothing","5"
"Finish wish","This is a Finish wish","0x02135ae4","Sports","6"
"Decision camera","This is a Decision camera","0x02135ae4","Art","7"
"Base establish people treatment","This is a Base establish people treatment","0x02135ae4","Camera","8"
"Short so defense live","This is a Short so defense live","0x02135ae4","Grocery","9"
"Garden rather form","This is a Garden rather form","0x02135ae4","Health","10"
"Same practice four stay","This is a Same practice four stay","0x02135ae4","Electronics","1"
"Unit nearly","This is a Unit nearly","0x02135ae4","Toys","2"
"Couple his can already side","This is a Couple his can already side","0x02135ae4","Games","3"
"Education down anyone in","This is a Education down anyone in","0x02135ae4","Books","4"
"Hit imagine","This is a Hit imagine","0x02135ae4","Clothing","5"
"Make can","This is a Make can","0x02135ae4","Sports","6"
"Them authority","This is a Them authority","0x02135ae4","Art","7"
"Green role","This is a Green role","0x02135ae4","Camera","8"
"Bad continue","This is a Bad continue","0x02135ae4","Grocery","9"
"Listen deal dinner","This is a Listen deal dinner","0x02135ae4","Health","10"
"Range Republican value effect pick","This is a Range Republican value effect pick","0x02135ae4","Electronics","1"
"Market building hot style","This is a Market building hot style","0x02135ae4","Toys","2"
"Contain list decision many program","This is a Contain list decision many program","0x02135ae4","Games","3"
"High about wish half","This is a High about wish half","0x02135ae4","Books","4"
"Exactly standard big affect consider","This is a Exactly standard big affect consider","0x02135ae4","Clothing","5"
"Figure cultural view together bar","This is a Figure cultural view together bar","0x02135ae4","Sports","6"
"Yes security add service","This is a Yes security add service","0x02135ae4","Art","7"
"Determine car","This is a Determine car","0x02135ae4","Camera","8"
"Way ground wait accept number","This is a Way ground wait accept number","0x02135ae4","Grocery","9"
"Successful source plant","This is a Successful source plant","0x02135ae4","Health","10"
"Remain raise those similar training","This is a Remain raise those similar training","0x02135ae4","Electronics","1"
"Fear list","This is a Fear list","0x02135ae4","Toys","2"
"Thing west","This is a Thing west","0x02135ae4","Games","3"
"Role west player bar","This is a Role west player bar","0x02135ae4","Books","4"
"Design treatment table star between","This is a Design treatment table star between","0x02135ae4","Clothing","5"
"Weight age young current","This is a Weight age young current","0x02135ae4","Sports","6"
"Relationship determine on","This is a Relationship determine on","0x02135ae4","Art","7"
"Executive stage hope action","This is a Executive stage hope action","0x02135ae4","Camera","8"
"Do arrive price behavior","This is a Do arrive price behavior","0x02135ae4","Grocery","9"
"Trouble measure value occur leg","This is a Trouble measure value occur leg","0x02135ae4","Health","10"
"Deal among place decide","This is a Deal among place decide","0x02135ae4","Electronics","1"
"Project two letter form","This is a Project two letter form","0x02135ae4","Toys","2"
"Seek charge friend","This is a Seek charge friend","0x02135ae4","Games","3"
"Since go into hand","This is a Since go into hand","0x02135ae4","Books","4"
"Significant ability always help","This is a Significant ability always help","0x02135ae4","Clothing","5"
"Memory recently pretty PM source","This is a Memory recently pretty PM source","0x02135ae4","Sports","6"
"Drive real data","This is a Drive real data","0x02135ae4","Art","7"
"Wrong so list","This is a Wrong so list","0x02135ae4","Camera","8"
"White enjoy join","This is a White enjoy join","0x02135ae4","Grocery","9"
"Begin morning enough tree","This is a Begin morning enough tree","0x02135ae4","Health","10"
"Particular institution","This is a Particular institution","0x02135ae4","Electronics","1"
"Glass Mr my night","This is a Glass Mr my night","0x02135ae4","Toys","2"
"None attack same base","This is a None attack same base","0x02135ae4","Games","3"
"Many cold firm","This is a Many cold firm","0x02135ae4","Books","4"
"Student perhaps side course","This is a Student perhaps side course","0x02135ae4","Clothing","5"
"Hundred doctor body result attorney","This is a Hundred doctor body result attorney","0x02135ae4","Sports","6"
"Bank condition reduce energy animal","This is a Bank condition reduce energy animal","0x02135ae4","Art","7"
"By can this will right","This is a By can this will right","0x02135ae4","Camera","8"
"Election wonder low","This is a Election wonder low","0x02135ae4","Grocery","9"
"President cut table boy her","This is a President cut table boy her","0x02135ae4","Health","10"
"Chair cut early","This is a Chair cut early","0x02135ae4","Electronics","1"
"Blood left deal particularly night","This is a Blood left deal particularly night","0x02135ae4","Toys","2"
"Young how","This is a Young how","0x02135ae4","Games","3"
"Stock hand red speak","This is a Stock hand red speak","0x02135ae4","Books","4"
"Thank what","This is a Thank what","0x02135ae4","Clothing","5"
"Such bag require her market","This is a Such bag require her market","0x02135ae4","Sports","6"
"This network on shoulder","This is a This network on shoulder","0x02135ae4","Art","7"
"Participant hope","This is a Participant hope","0x02135ae4","Camera","8"
"Oil forget heart truth","This is a Oil forget heart truth","0x02135ae4","Grocery","9"
"Pass gun choose single special","This is a Pass gun choose single special","0x02135ae4","Health","10"
"Need fly north much drive","This is a Need fly north much drive","0x02135ae4","Electronics","1"
"Plant support doctor above","This is a Plant support doctor above","0x02135ae4","Toys","2"
"Early game different forward human","This is a Early game different forward human","0x02135ae4","Games","3"
