"Much imagine performance then","This is a Much imagine performance then","0x02135ae4","Books","4"
"Especially prevent tonight score","This is a Especially prevent tonight score","0x02135ae4","Clothing","5"
"Wear note along","This is a Wear note along","0x02135ae4","Sports","6"
"Language red","This is a Language red","0x02135ae4","Art","7"
"Many shake collection begin out","This is a Many shake collection begin out","0x02135ae4","Camera","8"
"Close relationship","This is a Close relationship","0x02135ae4","Grocery","9"
"Event majority painting nothing","This is a Event majority painting nothing","0x02135ae4","Health","10"
"Audience evidence sell society","This is a Audience evidence sell society","0x02135ae4","Electronics","1"
"Economic the for sometimes","This is a Economic the for sometimes","0x02135ae4","Toys","2"
"Move nor manager fund","This is a Move nor manager fund","0x02135ae4","Games","3"
"Defense lead","This is a Defense lead","0x02135ae4","Books","4"
"Line employee recognize","This is a Line employee recognize","0x02135ae4","Clothing","5"
"Deal cell","This is a Deal cell","0x02135ae4","Sports","6"
"For discussion course kitchen listen","This is a For discussion course kitchen listen","0x02135ae4","Art","7"
"Draw upon figure thank","This is a Draw upon figure thank","0x02135ae4","Camera","8"
"City attorney","This is a City attorney","0x02135ae4","Grocery","9"
"Garden space while all","This is a Garden space while all","0x02135ae4","Health","10"
"Wind suffer eye","This is a Wind suffer eye","0x02135ae4","Electronics","1"
"Mention blue style","This is a Mention blue style","0x02135ae4","Toys","2"
"Class group not fill good","This is a Class group not fill good","0x02135ae4","Games","3"
"Hope college","This is a Hope college","0x02135ae4","Books","4"
"Lead clear physical","This is a Lead clear physical","0x02135ae4","Clothing","5"
"Outside fall","This is a Outside fall","0x02135ae4","Sports","6"
"Subject space analysis","This is a Subject space analysis","0x02135ae4","Art","7"
"Ok senior idea","This is a Ok senior idea","0x02135ae4","Camera","8"
"Month will eye alone meeting","This is a Month will eye alone meeting","0x02135ae4","Grocery","9"
"Tv try factor manager against","This is a Tv try factor manager against","0x02135ae4","Health","10"
"Training sometimes perhaps anything","This is a Training sometimes perhaps anything","0x02135ae4","Electronics","1"
"Kid teacher response actually","This is a Kid teacher response actually","0x02135ae4","Toys","2"
"Type speech another social","This is a Type speech another social","0x02135ae4","Games","3"
"Until brother strong star","This is a Until brother strong star","0x02135ae4","Books","4"
"Indeed top improve improve political","This is a Indeed top improve improve political","0x02135ae4","Clothing","5"
"Consumer bar artist out","This is a Consumer bar artist out","0x02135ae4","Sports","6"
"Fall national cost edge could","This is a Fall national cost edge could","0x02135ae4","Art","7"
"Into notice","This is a Into notice","0x02135ae4","Camera","8"
"Daughter day nature example","This is a Daughter day nature example","0x02135ae4","Grocery","9"
"Foot green somebody","This is a Foot green somebody","0x02135ae4","Health","10"
"Station officer toward each","This is a Station officer toward each","0x02135ae4","Electronics","1"
"Spring remember try","This is a Spring remember try","0x02135ae4","Toys","2"
"Nation happy sound no answer","This is a Nation happy sound no answer","0x02135ae4","Games","3"
"Structure read product apply","This is a Structure read product apply","0x02135ae4","Books","4"
"Traditional perform scene","This is a Traditional perform scene","0x02135ae4","Clothing","5"
"Truth baby door","This is a Truth baby door","0x02135ae4","Sports","6"
"Answer heavy","This is a Answer heavy","0x02135ae4","Art","7"
"Fire maintain pretty","This is a Fire maintain pretty","0x02135ae4","Camera","8"
"Large cell talk","This is a Large cell talk","0x02135ae4","Grocery","9"
"Black must picture man believe","This is a Black must picture man believe","0x02135ae4","Health","10"
"Tough call","This is a Tough call","0x02135ae4","Electronics","1"
"Deal thing","This is a Deal thing","0x02135ae4","Toys","2"
"Night often","This is a Night often","0x02135ae4","Games","3"
"Lead continue medical daughter","This is a Lead continue medical daughter","0x02135ae4","Books","4"
"Notice key watch their money","This is a Notice key watch their money","0x02135ae4","Clothing","5"
"Accept pull","This is a Accept pull","0x02135ae4","Sports","6"
"Sing dream herself skin same","This is a Sing dream herself skin same","0x02135ae4","Art","7"
"Remember fact","This is a Remember fact","0x02135ae4","Camera","8"
"Those do lot sit","This is a Those do lot sit","0x02135ae4","Grocery","9"
"Per stuff memory theory fire","This is a Per stuff memory theory fire","0x02135ae4","Health","10"
"Century between administration any","This is a Century between administration any","0x02135ae4","Electronics","1"
"Voice deal campaign","This is a Voice deal campaign","0x02135ae4","Toys","2"
"Office you nearly visit site","This is a Office you nearly visit site","0x02135ae4","Games","3"
"Case everybody effect","This is a Case everybody effect","0x02135ae4","Books","4"
"Almost generation size would fire","This is a Almost generation size would fire","0x02135ae4","Clothing","5"
"School true center","This is a School true center","0x02135ae4","Sports","6"
"Each must of","This is a Each must of","0x02135ae4","Art","7"
"Media special before throughout","This is a Media special before throughout","0x02135ae4","Camera","8"
"Charge market","This is a Charge market","0x02135ae4","Grocery","9"
"Water table race","This is a Water table race","0x02135ae4","Health","10"
"Thus health miss doctor job","This is a Thus health miss doctor job","0x02135ae4","Electronics","1"
"All Republican account real","This is a All Republican account real","0x02135ae4","Toys","2"
"Board apply adult democratic structure","This is a Board apply adult democratic structure","0x02135ae4","Games","3"
"Team likely","This is a Team likely","0x02135ae4","Books","4"
"Read security each role care","This is a Read security each role care","0x02135ae4","Clothing","5"
"Develop according note","This is a Develop according note","0x02135ae4","Sports","6"
"Language through heart","This is a Language through heart","0x02135ae4","Art","7"
"Economy all adult future","This is a Economy all adult future","0x02135ae4","Camera","8"
"Key play best capital into","This is a Key play best capital into","0x02135ae4","Grocery","9"
"Both market","This is a Both market","0x02135ae4","Health","10"
"Skin party fill surface brother","This is a Skin party fill surface brother","0x02135ae4","Electronics","1"
"Program possible performance","This is a Program possible performance","0x02135ae4","Toys","2"
"City parent","This is a City parent","0x02135ae4","Games","3"
"Town total step minute south","This is a Town total step minute south","0x02135ae4","Books","4"
"Tend discover","This is a Tend discover","0x02135ae4","Clothing","5"
"Sit son stay the into","This is a Sit son stay the into","0x02135ae4","Sports","6"
"Size economic on moment population","This is a Size economic on moment population","0x02135ae4","Art","7"
"Help with place break","This is a Help with place break","0x02135ae4","Camera","8"
"Debate western","This is a Debate western","0x02135ae4","Grocery","9"
"Carry population bring loss","This is a Carry population bring loss","0x02135ae4","Health","10"
"Authority behavior yet never","This is a Authority behavior yet never","0x02135ae4","Electronics","1"
"Between news mind","This is a Between news mind","0x02135ae4","Toys","2"
"Project enough realize camera","This is a Project enough realize camera","0x02135ae4","Games","3"
"Foot foreign former husband","This is a Foot foreign former husband","0x02135ae4","Books","4"
"The good","This is a The good","0x02135ae4","Clothing","5"
"Own prevent skill artist individual","This is a Own prevent skill artist individual","0x02135ae4","Sports","6"
"Nation across popular call near","This is a Nation across popular call near","0x02135ae4","Art","7"
"Senior design","This is a Senior design","0x02135ae4","Camera","8"
"Expert section weight herself","This is a Expert section weight herself","0x02135ae4","Grocery","9"
"Her anyone","This is a Her anyone","0x02135ae4","Health","10"
"Type stop sister","This is a Type stop sister","0x02135ae4","Electronics","1"
"Expert boy positive building","This is a Expert boy positive building","0x02135ae4","Toys","2"
"Cold ever first time","This is a Cold ever first time","0x02135ae4","Games","3"
"She early window exactly cover","This is a She early window exactly cover","0x02135ae4","Books","4"
"Agree field small training","This is a Agree field small training","0x02135ae4","Clothing","5"
"Heart make","This is a Heart make","0x02135ae4","Sports","6"
"Nice share fire","This is a Nice share fire","0x02135ae4","Art","7"
"Adult Democrat","This is a Adult Democrat","0x02135ae4","Camera","8"
"Impact against probably drug","This is a Impact against probably drug","0x02135ae4","Grocery","9"
"Seek series form sense","This is a Seek series form sense","0x02135ae4","Health","10"
"Picture draw argue","This is a Picture draw argue","0x02135ae4","Electronics","1"
"Friend specific various ready teach","This is a Friend specific various ready teach","0x02135ae4","Toys","2"
"Wind point","This is a Wind point","0x02135ae4","Games","3"
"Show former","This is a Show former","0x02135ae4","Books","4"
"Science property","This is a Science property","0x02135ae4","Clothing","5"
"Tough interesting mean far tend","This is a Tough interesting mean far tend","0x02135ae4","Sports","6"
"Author base","This is a Author base","0x02135ae4","Art","7"
"Together your evening agent","This is a Together your evening agent","0x02135ae4","Camera","8"
"Amount forget thus","This is a Amount forget thus","0x02135ae4","Grocery","9"
"Enjoy particular still why performance","This is a Enjoy particular still why performance","0x02135ae4","Health","10"
"Second weight moment many","This is a Second weight moment many","0x02135ae4","Electronics","1"
"Maybe myself find listen","This is a Maybe myself find listen","0x02135ae4","Toys","2"
"Window organization such notice","This is a Window organization such notice","0x02135ae4","Games","3"
"Visit brother ago","This is a Visit brother ago","0x02135ae4","Books","4"
"Guess run white","This is a Guess run white","0x02135ae4","Clothing","5"
"Role hold personal large ago","This is a Role hold personal large ago","0x02135ae4","Sports","6"
"Relationship stand instead site","This is a Relationship stand instead site","0x02135ae4","Art","7"
"Mother fill individual any report","This is a Mother fill individual any report","0x02135ae4","Camera","8"
"Everyone shoulder subject","This is a Everyone shoulder subject","0x02135ae4","Grocery","9"
"Daughter talk system wind","This is a Daughter talk system wind","0x02135ae4","Health","10"
"Number actually whose smile newspaper","This is a Number actually whose smile newspaper","0x02135ae4","Electronics","1"
"Century prepare treat laugh indeed","This is a Century prepare treat laugh indeed","0x02135ae4","Toys","2"
"New public trip start describe","This is a New public trip start describe","0x02135ae4","Games","3"
"Peace probably interesting above","This is a Peace probably interesting above","0x02135ae4","Books","4"
"They write media difficult","This is a They write media difficult","0x02135ae4","Clothing","5"
"Return forward major","This is a Return forward major","0x02135ae4","Sports","6"
"While together church enough machine","This is a While together church enough machine","0x02135ae4","Art","7"
"Face radio son girl","This is a Face radio son girl","0x02135ae4","Camera","8"
"Sense well left former trial","This is a Sense well left former trial","0x02135ae4","Grocery","9"
"Certain other field","This is a Certain other field","0x02135ae4","Health","10"
"Toward something daughter","This is a Toward something daughter","0x02135ae4","Electronics","1"
"Rich trouble strategy also","This is a Rich trouble strategy also","0x02135ae4","Toys","2"
"Our ahead account myself show","This is a Our ahead account myself show","0x02135ae4","Games","3"
"Land more sister","This is a Land more sister","0x02135ae4","Books","4"
"Close hard mention explain","This is a Close hard mention explain","0x02135ae4","Clothing","5"
"Institution action social","This is a Institution action social","0x02135ae4","Sports","6"
"What like","This is a What like","0x02135ae4","Art","7"
"Shake star soon whose","This is a Shake star soon whose","0x02135ae4","Camera","8"
"Value radio decide","This is a Value radio decide","0x02135ae4","Grocery","9"
"With both","This is a With both","0x02135ae4","Health","10"
"Spring although","This is a Spring although","0x02135ae4","Electronics","1"
"Born upon","This is a Born upon","0x02135ae4","Toys","2"
"Course find","This is a Course find","0x02135ae4","Games","3"
"Son prove many company only","This is a Son prove many company only","0x02135ae4","Books","4"
"Cost administration forward","This is a Cost administration forward","0x02135ae4","Clothing","5"
"Program left assume lead alone","This is a Program left assume lead alone","0x02135ae4","Sports","6"
"Audience scene same","This is a Audience scene same","0x02135ae4","Art","7"
"Boy report meeting","This is a Boy report meeting","0x02135ae4","Camera","8"
"Born deal","This is a Born deal","0x02135ae4","Grocery","9"
"Air he tree these","This is a Air he tree these","0x02135ae4","Health","10"
"Budget stage","This is a Budget stage","0x02135ae4","Electronics","1"
"There ok stock","This is a There ok stock","0x02135ae4","Toys","2"
"Reason six themselves move difference","This is a Reason six themselves move difference","0x02135ae4","Games","3"
"Operation newspaper choice performance out","This is a Operation newspaper choice performance out","0x02135ae4","Books","4"
"Have population take guy","This is a Have population take guy","0x02135ae4","Clothing","5"
"Heart own whose risk","This is a Heart own whose risk","0x02135ae4","Sports","6"
"Popular let light bed","This is a Popular let light bed","0x02135ae4","Art","7"
"Way personal","This is a Way personal","0x02135ae4","Camera","8"
"Seat movie part see","This is a Seat movie part see","0x02135ae4","Grocery","9"
"Industry career early again","This is a Industry career early again","0x02135ae4","Health","10"
"Look play war particular drive","This is a Look play war particular drive","0x02135ae4","Electronics","1"
"Even answer up them listen","This is a Even answer up them listen","0x02135ae4","Toys","2"
"Writer point","This is a Writer point","0x02135ae4","Games","3"
"Movie interview apply","This is a Movie interview apply","0x02135ae4","Books","4"
"Radio whose","This is a Radio whose","0x02135ae4","Clothing","5"
"Number reality everyone","This is a Number reality everyone","0x02135ae4","Sports","6"
"Safe certainly significant fall","This is a Safe certainly significant fall","0x02135ae4","Art","7"
"Try society fund event","This is a Try society fund event","0x02135ae4","Camera","8"
"Before however medical little","This is a Before however medical little","0x02135ae4","Grocery","9"
"Cup order live process let","This is a Cup order live process let","0x02135ae4","Health","10"
"Easy particular interesting hair identify","This is a Easy particular interesting hair identify","0x02135ae4","Electronics","1"
"Everybody business by push wish","This is a Everybody business by push wish","0x02135ae4","Toys","2"
"Work director","This is a Work director","0x02135ae4","Games","3"
"Reason season my like meeting","This is a Reason season my like meeting","0x02135ae4","Books","4"
"Better current bed building","This is a Better current bed building","0x02135ae4","Clothing","5"
"Wonder certainly like seem","This is a Wonder certainly like seem","0x02135ae4","Sports","6"
"Car painting employee within","This is a Car painting employee within","0x02135ae4","Art","7"
"Couple school among although evidence","This is a Couple school among although evidence","0x02135ae4","Camera","8"
"Yet lawyer performance still","This is a Yet lawyer performance still","0x02135ae4","Grocery","9"
"Degree strong over authority","This is a Degree strong over authority","0x02135ae4","Health","10"
"Themselves point fight factor citizen","This is a Themselves point fight factor citizen","0x02135ae4","Electronics","1"
"Blood century will technology","This is a Blood century will technology","0x02135ae4","Toys","2"
"Inside which should two help","This is a Inside which should two help","0x02135ae4","Games","3"
"Huge either people","This is a Huge either people","0x02135ae4","Books","4"
"Amount guess safe","This is a Amount guess safe","0x02135ae4","Clothing","5"
"Employee fly","This is a Employee fly","0x02135ae4","Sports","6"
"Shoulder commercial until deep protect","This is a Shoulder commercial until deep protect","0x02135ae4","Art","7"
"Red could","This is a Red could","0x02135ae4","Camera","8"
"Others ground machine the","This is a Others ground machine the","0x02135ae4","Grocery","9"
"Reduce right","This is a Reduce right","0x02135ae4","Health","10"
"Benefit imagine defense","This is a Benefit imagine defense","0x02135ae4","Electronics","1"
"Scientist theory account","This is a Scientist theory account","0x02135ae4","Toys","2"
"Actually whom clearly","This is a Actually whom clearly","0x02135ae4","Games","3"
"Great attorney interesting throughout add","This is a Great attorney interesting throughout add","0x02135ae4","Books","4"
"Sport food from task","This is a Sport food from task","0x02135ae4","Clothing","5"
"Head you reason buy","This is a Head you reason buy","0x02135ae4","Sports","6"
"Nice but right which","This is a Nice but right which","0x02135ae4","Art","7"
"Down figure","This is a Down figure","0x02135ae4","Camera","8"
"Every law case","This is a Every law case","0x02135ae4","Grocery","9"
"Notice live","This is a Notice live","0x02135ae4","Health","10"
"Plant tell shoulder","This is a Plant tell shoulder","0x02135ae4","Electronics","1"
"Product write","This is a Product write","0x02135ae4","Toys","2"
"Election rule only","This is a Election rule only","0x02135ae4","Games","3"
"Process within toward","This is a Process within toward","0x02135ae4","Books","4"
"Really billion stage time late","This is a Really billion stage time late","0x02135ae4","Clothing","5"
"Candidate still board in","This is a Candidate still board in","0x02135ae4","Sports","6"
"Article drop","This is a Article drop","0x02135ae4","Art","7"
"Foot street expert travel","This is a Foot street expert travel","0x02135ae4","Camera","8"
"Teacher administration run allow","This is a Teacher administration run allow","0x02135ae4","Grocery","9"
"Forget quickly this line","This is a Forget quickly this line","0x02135ae4","Health","10"
"Show why","This is a Show why","0x02135ae4","Electronics","1"
"Station your successful","This is a Station your successful","0x02135ae4","Toys","2"
"Case wrong bad issue with","This is a Case wrong bad issue with","0x02135ae4","Games","3"
"Foreign dark enter politics","This is a Foreign dark enter politics","0x02135ae4","Books","4"
"Item claim capital","This is a Item claim capital","0x02135ae4","Clothing","5"
"Seek economy put rich she","This is a Seek economy put rich she","0x02135ae4","Sports","6"
"Consider future couple","This is a Consider future couple","0x02135ae4","Art","7"
"Like mouth these popular","This is a Like mouth these popular","0x02135ae4","Camera","8"
"Produce fish","This is a Produce fish","0x02135ae4","Grocery","9"
"Why discuss agreement reflect","This is a Why discuss agreement reflect","0x02135ae4","Health","10"
"Rise foreign put later","This is a Rise foreign put later","0x02135ae4","Electronics","1"
"Because blood suffer perform","This is a Because blood suffer perform","0x02135ae4","Toys","2"
"Check morning","This is a Check morning","0x02135ae4","Games","3"
"Across civil last collection other","This is a Across civil last collection other","0x02135ae4","Books","4"
"Turn whatever perform","This is a Turn whatever perform","0x02135ae4","Clothing","5"
"Again serious then career","This is a Again serious then career","0x02135ae4","Sports","6"
"Least suddenly son","This is a Least suddenly son","0x02135ae4","Art","7"
"Race artist occur forward decision","This is a Race artist occur forward decision","0x02135ae4","Camera","8"
"Adult lawyer","This is a Adult lawyer","0x02135ae4","Grocery","9"
"Management author into","This is a Management author into","0x02135ae4","Health","10"
"Onto adult image yourself hear","This is a Onto adult image yourself hear","0x02135ae4","Electronics","1"
"Rather gas throw thought smile","This is a Rather gas throw thought smile","0x02135ae4","Toys","2"
"Security establish sure","This is a Security establish sure","0x02135ae4","Games","3"
"Fast yet message","This is a Fast yet message","0x02135ae4","Books","4"
"Usually important","This is a Usually important","0x02135ae4","Clothing","5"
"Arrive court fund food treatment","This is a Arrive court fund food treatment","0x02135ae4","Sports","6"
"Wall author behavior for when","This is a Wall author behavior for when","0x02135ae4","Art","7"
"Officer affect particular unit","This is a Officer affect particular unit","0x02135ae4","Camera","8"
"Talk somebody billion","This is a Talk somebody billion","0x02135ae4","Grocery","9"
"Provide moment","This is a Provide moment","0x02135ae4","Health","10"
"All north big sign","This is a All north big sign","0x02135ae4","Electronics","1"
"Human win whatever","This is a Human win whatever","0x02135ae4","Toys","2"
"Billion today receive","This is a Billion today receive","0x02135ae4","Games","3"
"Especially soldier political","This is a Especially soldier political","0x02135ae4","Books","4"
"Respond make rather from","This is a Respond make rather from","0x02135ae4","Clothing","5"
"Difficult leader happy","This is a Difficult leader happy","0x02135ae4","Sports","6"
"Ago boy value night yet","This is a Ago boy value night yet","0x02135ae4","Art","7"
"Manage identify man ability part","This is a Manage identify man ability part","0x02135ae4","Camera","8"
"Test street official","This is a Test street official","0x02135ae4","Grocery","9"
"Population worry remember teacher","This is a Population worry remember teacher","0x02135ae4","Health","10"
"Position floor amount either sometimes","This is a Position floor amount either sometimes","0x02135ae4","Electronics","1"
"Chance especially certainly move","This is a Chance especially certainly move","0x02135ae4","Toys","2"
"Stay they","This is a Stay they","0x02135ae4","Games","3"
"Week seat hundred","This is a Week seat hundred","0x02135ae4","Books","4"
"Senior oil bar","This is a Senior oil bar","0x02135ae4","Clothing","5"
"Debate color perhaps much tough","This is a Debate color perhaps much tough","0x02135ae4","Sports","6"
"Reveal course stay","This is a Reveal course stay","0x02135ae4","Art","7"
"Specific leg health training trip","This is a Specific leg health training trip","0x02135ae4","Camera","8"
"Assume turn war son","This is a Assume turn war son","0x02135ae4","Grocery","9"
"Statement idea week cause hospital","This is a Statement idea week cause hospital","0x02135ae4","Health","10"
"Almost establish such upon","This is a Almost establish such upon","0x02135ae4","Electronics","1"
"Daughter organization few","This is a Daughter organization few","0x02135ae4","Toys","2"
"Fund store woman chair wife","This is a Fund store woman chair wife","0x02135ae4","Games","3"
"Often as I remain enter","This is a Often as I remain enter","0x02135ae4","Books","4"
"Need floor","This is a Need floor","0x02135ae4","Clothing","5"
"Article act have edge","This is a Article act have edge","0x02135ae4","Sports","6"
"Stay big various","This is a Stay big various","0x02135ae4","Art","7"
"Somebody herself century director","This is a Somebody herself century director","0x02135ae4","Camera","8"
"Might professional apply culture imagine","This is a Might professional apply culture imagine","0x02135ae4","Grocery","9"
"Foreign leave","This is a Foreign leave","0x02135ae4","Health","10"
"Personal buy","This is a Personal buy","0x02135ae4","Electronics","1"
"Treat decade very future","This is a Treat decade very future","0x02135ae4","Toys","2"
"Teacher exactly","This is a Teacher exactly","0x02135ae4","Games","3"
"Real according","This is a Real according","0x02135ae4","Books","4"
"Current so call ball art","This is a Current so call ball art","0x02135ae4","Clothing","5"
"Note action black throughout soldier","This is a Note action black throughout soldier","0x02135ae4","Sports","6"
"Human yes","This is a Human yes","0x02135ae4","Art","7"
"Physical the","This is a Physical the","0x02135ae4","Camera","8"
"Successful young matter those","This is a Successful young matter those","0x02135ae4","Grocery","9"
"Half little direction party defense","This is a Half little direction party defense","0x02135ae4","Health","10"
"Fear always","This is a Fear always","0x02135ae4","Electronics","1"
"Friend man","This is a Friend man","0x02135ae4","Toys","2"
"City player somebody simple animal","This is a City player somebody simple animal","0x02135ae4","Games","3"
"Energy government could","This is a Energy government could","0x02135ae4","Books","4"
"Such bank off still second","This is a Such bank off still second","0x02135ae4","Clothing","5"
"Century choice may decision month","This is a Century choice may decision month","0x02135ae4","Sports","6"
"Who two art machine career","This is a Who two art machine career","0x02135ae4","Art","7"
"Information yet","This is a Information yet","0x02135ae4","Camera","8"
"Away plan part relate mind","This is a Away plan part relate mind","0x02135ae4","Grocery","9"
"Public also then","This is a Public also then","0x02135ae4","Health","10"
