"College next son","This is a College next son","0x02135ae4","Books","4"
"Once impact agreement according","This is a Once impact agreement according","0x02135ae4","Clothing","5"
"Bring matter lay fish either","This is a Bring matter lay fish either","0x02135ae4","Sports","6"
"Different include","This is a Different include","0x02135ae4","Art","7"
"Fact economic never sort","This is a Fact economic never sort","0x02135ae4","Camera","8"
"Drug itself prove enjoy someone","This is a Drug itself prove enjoy someone","0x02135ae4","Grocery","9"
"Present pattern court bill","This is a Present pattern court bill","0x02135ae4","Health","10"
"Walk letter amount","This is a Walk letter amount","0x02135ae4","Electronics","1"
"Drive inside nice","This is a Drive inside nice","0x02135ae4","Toys","2"
"Ask action top identify","This is a Ask action top identify","0x02135ae4","Games","3"
"Open involve with","This is a Open involve with","0x02135ae4","Books","4"
"Century cost room blue media","This is a Century cost room blue media","0x02135ae4","Clothing","5"
"Couple fall order record type","This is a Couple fall order record type","0x02135ae4","Sports","6"
"Affect pull thing consider region","This is a Affect pull thing consider region","0x02135ae4","Art","7"
"Run somebody nor","This is a Run somebody nor","0x02135ae4","Camera","8"
"Accept discuss leave","This is a Accept discuss leave","0x02135ae4","Grocery","9"
"Pressure him professional book","This is a Pressure him professional book","0x02135ae4","Health","10"
"Alone feeling next show","This is a Alone feeling next show","0x02135ae4","Electronics","1"
"Continue day","This is a Continue day","0x02135ae4","Toys","2"
"Sometimes require finally","This is a Sometimes require finally","0x02135ae4","Games","3"
"Imagine community value store suddenly","This is a Imagine community value store suddenly","0x02135ae4","Books","4"
"Instead morning agree either","This is a Instead morning agree either","0x02135ae4","Clothing","5"
"Though meeting new Republican","This is a Though meeting new Republican","0x02135ae4","Sports","6"
"Young compare kid themselves road","This is a Young compare kid themselves road","0x02135ae4","Art","7"
"Night step personal sea rest","This is a Night step personal sea rest","0x02135ae4","Camera","8"
"Hair follow time set nor","This is a Hair follow time set nor","0x02135ae4","Grocery","9"
"A require suffer agency nor","This is a A require suffer agency nor","0x02135ae4","Health","10"
"Threat him how ok","This is a Threat him how ok","0x02135ae4","Electronics","1"
"Again leg field activity","This is a Again leg field activity","0x02135ae4","Toys","2"
"Hour offer report after build","This is a Hour offer report after build","0x02135ae4","Games","3"
"Hospital about write sport former","This is a Hospital about write sport former","0x02135ae4","Books","4"
"Medical account","This is a Medical account","0x02135ae4","Clothing","5"
"Bad no agree sit night","This is a Bad no agree sit night","0x02135ae4","Sports","6"
"Guess move add","This is a Guess move add","0x02135ae4","Art","7"
"South include mission","This is a South include mission","0x02135ae4","Camera","8"
"Fill detail less","This is a Fill detail less","0x02135ae4","Grocery","9"
"Tree deal front decade","This is a Tree deal front decade","0x02135ae4","Health","10"
"Up people","This is a Up people","0x02135ae4","Electronics","1"
"Director beyond situation cell","This is a Director beyond situation cell","0x02135ae4","Toys","2"
"Sister red necessary","This is a Sister red necessary","0x02135ae4","Games","3"
"Box letter","This is a Box letter","0x02135ae4","Books","4"
"Person purpose animal task","This is a Person purpose animal task","0x02135ae4","Clothing","5"
"Out skin foreign improve","This is a Out skin foreign improve","0x02135ae4","Sports","6"
"Service commercial generation","This is a Service commercial generation","0x02135ae4","Art","7"
"Believe impact product","This is a Believe impact product","0x02135ae4","Camera","8"
"Plant six agree","This is a Plant six agree","0x02135ae4","Grocery","9"
"Study share agree","This is a Study share agree","0x02135ae4","Health","10"
"Suggest left our which","This is a Suggest left our which","0x02135ae4","Electronics","1"
"Enter challenge","This is a Enter challenge","0x02135ae4","Toys","2"
"Experience artist everyone white staff","This is a Experience artist everyone white staff","0x02135ae4","Games","3"
"Employee baby seven heavy music","This is a Employee baby seven heavy music","0x02135ae4","Books","4"
"Option rich reflect onto","This is a Option rich reflect onto","0x02135ae4","Clothing","5"
"Film often realize account network","This is a Film often realize account network","0x02135ae4","Sports","6"
"Down cold indicate there character","This is a Down cold indicate there character","0x02135ae4","Art","7"
"Off good much","This is a Off good much","0x02135ae4","Camera","8"
"Off plant commercial address artist","This is a Off plant commercial address artist","0x02135ae4","Grocery","9"
"Page very site score share","This is a Page very site score share","0x02135ae4","Health","10"
"Grow number garden data","This is a Grow number garden data","0x02135ae4","Electronics","1"
"Recognize accept purpose head","This is a Recognize accept purpose head","0x02135ae4","Toys","2"
"Culture others general recently","This is a Culture others general recently","0x02135ae4","Games","3"
"Here under machine could suddenly","This is a Here under machine could suddenly","0x02135ae4","Books","4"
"Thank improve out than","This is a Thank improve out than","0x02135ae4","Clothing","5"
"To worker","This is a To worker","0x02135ae4","Sports","6"
"Station suffer book score within","This is a Station suffer book score within","0x02135ae4","Art","7"
"Develop house market tree ahead","This is a Develop house market tree ahead","0x02135ae4","Camera","8"
"Much authority shake also","This is a Much authority shake also","0x02135ae4","Grocery","9"
"Responsibility American involve","This is a Responsibility American involve","0x02135ae4","Health","10"
"Option my serve","This is a Option my serve","0x02135ae4","Electronics","1"
"Mr minute","This is a Mr minute","0x02135ae4","Toys","2"
"Medical hit","This is a Medical hit","0x02135ae4","Games","3"
"Recently laugh same way","This is a Recently laugh same way","0x02135ae4","Books","4"
"Provide medical hour reveal","This is a Provide medical hour reveal","0x02135ae4","Clothing","5"
"Model perhaps his already","This is a Model perhaps his already","0x02135ae4","Sports","6"
"Area expert here","This is a Area expert here","0x02135ae4","Art","7"
"Including box improve factor","This is a Including box improve factor","0x02135ae4","Camera","8"
"Accept source site","This is a Accept source site","0x02135ae4","Grocery","9"
"Summer decision into fine","This is a Summer decision into fine","0x02135ae4","Health","10"
"Total then action laugh","This is a Total then action laugh","0x02135ae4","Electronics","1"
"Some whom program","This is a Some whom program","0x02135ae4","Toys","2"
"Most seek painting drug decide","This is a Most seek painting drug decide","0x02135ae4","Games","3"
"Meet southern during","This is a Meet southern during","0x02135ae4","Books","4"
"Course media","This is a Course media","0x02135ae4","Clothing","5"
"Direction he democratic me must","This is a Direction he democratic me must","0x02135ae4","Sports","6"
"Pressure call usually","This is a Pressure call usually","0x02135ae4","Art","7"
"Energy hundred low south owner","This is a Energy hundred low south owner","0x02135ae4","Camera","8"
"Top north method position","This is a Top north method position","0x02135ae4","Grocery","9"
"Particular building end return","This is a Particular building end return","0x02135ae4","Health","10"
"Run special suggest","This is a Run special suggest","0x02135ae4","Electronics","1"
"Beyond attention last simply dark","This is a Beyond attention last simply dark","0x02135ae4","Toys","2"
"End significant card coach","This is a End significant card coach","0x02135ae4","Games","3"
"Significant age everyone","This is a Significant age everyone","0x02135ae4","Books","4"
"Tonight although middle hot affect","This is a Tonight although middle hot affect","0x02135ae4","Clothing","5"
"Themselves upon his fly","This is a Themselves upon his fly","0x02135ae4","Sports","6"
"Time you man","This is a Time you man","0x02135ae4","Art","7"
"Officer consumer pattern","This is a Officer consumer pattern","0x02135ae4","Camera","8"
"Religious sing","This is a Religious sing","0x02135ae4","Grocery","9"
"Alone brother herself","This is a Alone brother herself","0x02135ae4","Health","10"
"Simple cold someone","This is a Simple cold someone","0x02135ae4","Electronics","1"
"Place course","This is a Place course","0x02135ae4","Toys","2"
"Risk decade candidate","This is a Risk decade candidate","0x02135ae4","Games","3"
"Arrive position herself around south","This is a Arrive position herself around south","0x02135ae4","Books","4"
"Land firm tax win look","This is a Land firm tax win look","0x02135ae4","Clothing","5"
"Blood some between animal raise","This is a Blood some between animal raise","0x02135ae4","Sports","6"
"Move tonight","This is a Move tonight","0x02135ae4","Art","7"
"Answer occur","This is a Answer occur","0x02135ae4","Camera","8"
"Let look","This is a Let look","0x02135ae4","Grocery","9"
"Line kid force wide","This is a Line kid force wide","0x02135ae4","Health","10"
"Answer carry size perhaps","This is a Answer carry size perhaps","0x02135ae4","Electronics","1"
"Week eye ok","This is a Week eye ok","0x02135ae4","Toys","2"
"Lot give people","This is a Lot give people","0x02135ae4","Games","3"
"Increase next natural range","This is a Increase next natural range","0x02135ae4","Books","4"
"Imagine artist customer owner decision","This is a Imagine artist customer owner decision","0x02135ae4","Clothing","5"
"Offer difficult particular sound","This is a Offer difficult particular sound","0x02135ae4","Sports","6"
"Oil adult size","This is a Oil adult size","0x02135ae4","Art","7"
"Impact would general","This is a Impact would general","0x02135ae4","Camera","8"
"About employee why","This is a About employee why","0x02135ae4","Grocery","9"
"Group carry","This is a Group carry","0x02135ae4","Health","10"
"Able popular red arm","This is a Able popular red arm","0x02135ae4","Electronics","1"
"Skin him way","This is a Skin him way","0x02135ae4","Toys","2"
"Station keep choice truth","This is a Station keep choice truth","0x02135ae4","Games","3"
"Where indicate decision southern growth","This is a Where indicate decision southern growth","0x02135ae4","Books","4"
"Unit notice memory run any","This is a Unit notice memory run any","0x02135ae4","Clothing","5"
"Development decision focus","This is a Development decision focus","0x02135ae4","Sports","6"
"Teacher among garden once good","This is a Teacher among garden once good","0x02135ae4","Art","7"
"Today few of recent mother","This is a Today few of recent mother","0x02135ae4","Camera","8"
"Behavior carry","This is a Behavior carry","0x02135ae4","Grocery","9"
"Off tree evening","This is a Off tree evening","0x02135ae4","Health","10"
"Conference street","This is a Conference street","0x02135ae4","Electronics","1"
"Condition station theory stop","This is a Condition station theory stop","0x02135ae4","Toys","2"
"Mission say us","This is a Mission say us","0x02135ae4","Games","3"
"Reveal thus modern thought","This is a Reveal thus modern thought","0x02135ae4","Books","4"
"Center move lay","This is a Center move lay","0x02135ae4","Clothing","5"
"East including consumer","This is a East including consumer","0x02135ae4","Sports","6"
"Both necessary help","This is a Both necessary help","0x02135ae4","Art","7"
"Alone development","This is a Alone development","0x02135ae4","Camera","8"
"Police may","This is a Police may","0x02135ae4","Grocery","9"
"Affect message body perhaps","This is a Affect message body perhaps","0x02135ae4","Health","10"
"Economic pay back play language","This is a Economic pay back play language","0x02135ae4","Electronics","1"
"Analysis prepare institution place","This is a Analysis prepare institution place","0x02135ae4","Toys","2"
"Could risk with","This is a Could risk with","0x02135ae4","Games","3"
"Final medical truth admit staff","This is a Final medical truth admit staff","0x02135ae4","Books","4"
"Nice industry culture face","This is a Nice industry culture face","0x02135ae4","Clothing","5"
"Bad home affect wear anything","This is a Bad home affect wear anything","0x02135ae4","Sports","6"
"Benefit chair","This is a Benefit chair","0x02135ae4","Art","7"
"Fast answer","This is a Fast answer","0x02135ae4","Camera","8"
"Meeting century lead","This is a Meeting century lead","0x02135ae4","Grocery","9"
"Soon hand","This is a Soon hand","0x02135ae4","Health","10"
"Leg west method","This is a Leg west method","0x02135ae4","Electronics","1"
"Peace long policy not","This is a Peace long policy not","0x02135ae4","Toys","2"
"Lead visit","This is a Lead visit","0x02135ae4","Games","3"
"Response hotel PM","This is a Response hotel PM","0x02135ae4","Books","4"
"If occur bit what provide","This is a If occur bit what provide","0x02135ae4","Clothing","5"
"Allow until push story poor","This is a Allow until push story poor","0x02135ae4","Sports","6"
"Information day","This is a Information day","0x02135ae4","Art","7"
"Everybody and build grow coach","This is a Everybody and build grow coach","0x02135ae4","Camera","8"
"Under degree when find east","This is a Under degree when find east","0x02135ae4","Grocery","9"
"Sea usually prove","This is a Sea usually prove","0x02135ae4","Health","10"
"Both let save much","This is a Both let save much","0x02135ae4","Electronics","1"
"Edge none each training","This is a Edge none each training","0x02135ae4","Toys","2"
"Industry close machine need","This is a Industry close machine need","0x02135ae4","Games","3"
"Friend thank four","This is a Friend thank four","0x02135ae4","Books","4"
"Response option instead full","This is a Response option instead full","0x02135ae4","Clothing","5"
"Much more federal suffer rich","This is a Much more federal suffer rich","0x02135ae4","Sports","6"
"Plant prepare evidence certain","This is a Plant prepare evidence certain","0x02135ae4","Art","7"
"Behavior will much address","This is a Behavior will much address","0x02135ae4","Camera","8"
"Someone whatever","This is a Someone whatever","0x02135ae4","Grocery","9"
"Point already world specific","This is a Point already world specific","0x02135ae4","Health","10"
"Relationship moment air director","This is a Relationship moment air director","0x02135ae4","Electronics","1"
"Than what","This is a Than what","0x02135ae4","Toys","2"
"Cover various","This is a Cover various","0x02135ae4","Games","3"
"Report certain possible","This is a Report certain possible","0x02135ae4","Books","4"
"Star large two leader","This is a Star large two leader","0x02135ae4","Clothing","5"
"West tonight color executive","This is a West tonight color executive","0x02135ae4","Sports","6"
"Country peace chair gas participant","This is a Country peace chair gas participant","0x02135ae4","Art","7"
"Collection head","This is a Collection head","0x02135ae4","Camera","8"
"Project oil","This is a Project oil","0x02135ae4","Grocery","9"
"Life near force group","This is a Life near force group","0x02135ae4","Health","10"
"Sister study","This is a Sister study","0x02135ae4","Electronics","1"
"Poor maybe structure","This is a Poor maybe structure","0x02135ae4","Toys","2"
"Include return bed","This is a Include return bed","0x02135ae4","Games","3"
"Board reflect wear","This is a Board reflect wear","0x02135ae4","Books","4"
"Congress economic option","This is a Congress economic option","0x02135ae4","Clothing","5"
"Various return lay","This is a Various return lay","0x02135ae4","Sports","6"
"Lead air carry","This is a Lead air carry","0x02135ae4","Art","7"
"Hard indeed example part","This is a Hard indeed example part","0x02135ae4","Camera","8"
"Simple focus","This is a Simple focus","0x02135ae4","Grocery","9"
"Several sing quality","This is a Several sing quality","0x02135ae4","Health","10"
"Say poor church positive","This is a Say poor church positive","0x02135ae4","Electronics","1"
"Last rich","This is a Last rich","0x02135ae4","Toys","2"
"Sign air method","This is a Sign air method","0x02135ae4","Games","3"
"Available public begin wear","This is a Available public begin wear","0x02135ae4","Books","4"
"President energy raise","This is a President energy raise","0x02135ae4","Clothing","5"
"Two school structure human","This is a Two school structure human","0x02135ae4","Sports","6"
"Huge player me","This is a Huge player me","0x02135ae4","Art","7"
"Ago ask half","This is a Ago ask half","0x02135ae4","Camera","8"
"Itself allow we Mr","This is a Itself allow we Mr","0x02135ae4","Grocery","9"
"While head development manage","This is a While head development manage","0x02135ae4","Health","10"
"Court place","This is a Court place","0x02135ae4","Electronics","1"
"Just military change better","This is a Just military change better","0x02135ae4","Toys","2"
"Investment partner kid network","This is a Investment partner kid network","0x02135ae4","Games","3"
"Property half deal","This is a Property half deal","0x02135ae4","Books","4"
"Green camera","This is a Green camera","0x02135ae4","Clothing","5"
"Either bit","This is a Either bit","0x02135ae4","Sports","6"
"Inside write","This is a Inside write","0x02135ae4","Art","7"
"Inside mind especially against measure","This is a Inside mind especially against measure","0x02135ae4","Camera","8"
"If news","This is a If news","0x02135ae4","Grocery","9"
"Teacher hold school","This is a Teacher hold school","0x02135ae4","Health","10"
"East suffer child four","This is a East suffer child four","0x02135ae4","Electronics","1"
"Represent general site how","This is a Represent general site how","0x02135ae4","Toys","2"
"Hope real security window","This is a Hope real security window","0x02135ae4","Games","3"
"Control their young although end","This is a Control their young although end","0x02135ae4","Books","4"
"Act little unit","This is a Act little unit","0x02135ae4","Clothing","5"
"Why pattern we","This is a Why pattern we","0x02135ae4","Sports","6"
"Professional professional remain recognize anyone","This is a Professional professional remain recognize anyone","0x02135ae4","Art","7"
"Result need","This is a Result need","0x02135ae4","Camera","8"
"Political though side than tonight","This is a Political though side than tonight","0x02135ae4","Grocery","9"
"Research somebody room","This is a Research somebody room","0x02135ae4","Health","10"
"Floor owner nearly learn until","This is a Floor owner nearly learn until","0x02135ae4","Electronics","1"
"Cold near","This is a Cold near","0x02135ae4","Toys","2"
"Lot task left professional attorney","This is a Lot task left professional attorney","0x02135ae4","Games","3"
"Whom response character nature carry","This is a Whom response character nature carry","0x02135ae4","Books","4"
"Then public need media first","This is a Then public need media first","0x02135ae4","Clothing","5"
"Sing officer trip last","This is a Sing officer trip last","0x02135ae4","Sports","6"
"Land onto board","This is a Land onto board","0x02135ae4","Art","7"
"Catch parent seem against popular","This is a Catch parent seem against popular","0x02135ae4","Camera","8"
"East quickly PM","This is a East quickly PM","0x02135ae4","Grocery","9"
"Serious method contain direction set","This is a Serious method contain direction set","0x02135ae4","Health","10"
"Follow yet meeting outside","This is a Follow yet meeting outside","0x02135ae4","Electronics","1"
"Talk education policy","This is a Talk education policy","0x02135ae4","Toys","2"
"Research daughter live final","This is a Research daughter live final","0x02135ae4","Games","3"
"Thing they it improve","This is a Thing they it improve","0x02135ae4","Books","4"
"Consumer usually upon","This is a Consumer usually upon","0x02135ae4","Clothing","5"
"Letter direction","This is a Letter direction","0x02135ae4","Sports","6"
"Service suggest federal","This is a Service suggest federal","0x02135ae4","Art","7"
"Station human audience","This is a Station human audience","0x02135ae4","Camera","8"
"Play exactly those fear","This is a Play exactly those fear","0x02135ae4","Grocery","9"
"Memory what admit may instead","This is a Memory what admit may instead","0x02135ae4","Health","10"
"Claim Mrs center imagine","This is a Claim Mrs center imagine","0x02135ae4","Electronics","1"
"Much public","This is a Much public","0x02135ae4","Toys","2"
"Stand friend","This is a Stand friend","0x02135ae4","Games","3"
"Series though early tend","This is a Series though early tend","0x02135ae4","Books","4"
"City television on","This is a City television on","0x02135ae4","Clothing","5"
"Thing suffer fact","This is a Thing suffer fact","0x02135ae4","Sports","6"
"Improve check religious teach","This is a Improve check religious teach","0x02135ae4","Art","7"
"Would daughter service subject","This is a Would daughter service subject","0x02135ae4","Camera","8"
"Choose simple","This is a Choose simple","0x02135ae4","Grocery","9"
"Easy outside","This is a Easy outside","0x02135ae4","Health","10"
"Practice church act","This is a Practice church act","0x02135ae4","Electronics","1"
"Over company fast country","This is a Over company fast country","0x02135ae4","Toys","2"
"Writer behind wide American","This is a Writer behind wide American","0x02135ae4","Games","3"
"Because again fast tell there","This is a Because again fast tell there","0x02135ae4","Books","4"
"May enter language","This is a May enter language","0x02135ae4","Clothing","5"
"Avoid goal","This is a Avoid goal","0x02135ae4","Sports","6"
"Few type feeling","This is a Few type feeling","0x02135ae4","Art","7"
"Front you coach note","This is a Front you coach note","0x02135ae4","Camera","8"
"Expect area","This is a Expect area","0x02135ae4","Grocery","9"
"Decision yes end stay","This is a Decision yes end stay","0x02135ae4","Health","10"
"Close sister drug","This is a Close sister drug","0x02135ae4","Electronics","1"
"Unit a improve similar","This is a Unit a improve similar","0x02135ae4","Toys","2"
"Pressure forget shake wish","This is a Pressure forget shake wish","0x02135ae4","Games","3"
"Nothing up wind","This is a Nothing up wind","0x02135ae4","Books","4"
"Tell choose new recognize","This is a Tell choose new recognize","0x02135ae4","Clothing","5"
"Young interesting hot mean produce","This is a Young interesting hot mean produce","0x02135ae4","Sports","6"
"Those draw forget relate have","This is a Those draw forget relate have","0x02135ae4","Art","7"
"Our a law both claim","This is a Our a law both claim","0x02135ae4","Camera","8"
"Style position","This is a Style position","0x02135ae4","Grocery","9"
"Media clear yourself","This is a Media clear yourself","0x02135ae4","Health","10"
"Hard would whom everyone","This is a Hard would whom everyone","0x02135ae4","Electronics","1"
"List bit positive","This is a List bit positive","0x02135ae4","Toys","2"
"Woman tell","This is a Woman tell","0x02135ae4","Games","3"
"Much knowledge reveal center step","This is a Much knowledge reveal center step","0x02135ae4","Books","4"
"Shake moment north himself","This is a Shake moment north himself","0x02135ae4","Clothing","5"
"Story yard good","This is a Story yard good","0x02135ae4","Sports","6"
"Imagine rate animal","This is a Imagine rate animal","0x02135ae4","Art","7"
"World condition industry memory north","This is a World condition industry memory north","0x02135ae4","Camera","8"
"Reality as dinner","This is a Reality as dinner","0x02135ae4","Grocery","9"
"Represent consider quality","This is a Represent consider quality","0x02135ae4","Health","10"
"Run decade","This is a Run decade","0x02135ae4","Electronics","1"
"Evening network","This is a Evening network","0x02135ae4","Toys","2"
"Night raise those three","This is a Night raise those three","0x02135ae4","Games","3"
"Decide both good cut college","This is a Decide both good cut college","0x02135ae4","Books","4"
"Great whole such finally","This is a Great whole such finally","0x02135ae4","Clothing","5"
"Chair around season","This is a Chair around season","0x02135ae4","Sports","6"
"Through ready across move ask","This is a Through ready across move ask","0x02135ae4","Art","7"
"Law area inside huge","This is a Law area inside huge","0x02135ae4","Camera","8"
"Late black west","This is a Late black west","0x02135ae4","Grocery","9"
"Picture example once","This is a Picture example once","0x02135ae4","Health","10"
"Knowledge field question now","This is a Knowledge field question now","0x02135ae4","Electronics","1"
"Myself street scientist window program","This is a Myself street scientist window program","0x02135ae4","Toys","2"
"Image hotel expert","This is a Image hotel expert","0x02135ae4","Games","3"
"School culture without","This is a School culture without","0x02135ae4","Books","4"
"Team grow which","This is a Team grow which","0x02135ae4","Clothing","5"
"Charge Democrat move human country","This is a Charge Democrat move human country","0x02135ae4","Sports","6"
"Best type","This is a Best type","0x02135ae4","Art","7"
"Build including other","This is a Build including other","0x02135ae4","Camera","8"
"Cause service can treatment ground","This is a Cause service can treatment ground","0x02135ae4","Grocery","9"
"Nature writer later cause expect","This is a Nature writer later cause expect","0x02135ae4","Health","10"
"Mean activity team democratic","This is a Mean activity team democratic","0x02135ae4","Electronics","1"
"Identify recently my owner statement","This is a Identify recently my owner statement","0x02135ae4","Toys","2"
"Experience game","This is a Experience game","0x02135ae4","Games","3"
